{
  "schema_version": "1.0.0",
  "feature_package_id": "feature-package/feat-docs-cms",
  "parent_feature": "feat-docs-cms",
  "source_feature_digest": "sha256:6e8ea8a7a1042002d0bb0b3ff2a2b3464ea4a45ba77ddea709580cc3bed03d34",
  "task_count": 13,
  "phase_refs": [
    "P01",
    "P02",
    "P03",
    "P04",
    "P05",
    "P06",
    "P07",
    "P08",
    "P09",
    "P10",
    "P11",
    "P12",
    "P13"
  ],
  "task_spec_paths": [
    "task-specs/phase-01-requirements.md",
    "task-specs/phase-02-architecture.md",
    "task-specs/phase-03-design-review.md",
    "task-specs/phase-04-test-design.md",
    "task-specs/phase-05-implementation.md",
    "task-specs/phase-06-test-run.md",
    "task-specs/phase-07-acceptance.md",
    "task-specs/phase-08-refactoring-migration.md",
    "task-specs/phase-09-quality-assurance.md",
    "task-specs/phase-10-final-review.md",
    "task-specs/phase-11-evidence.md",
    "task-specs/phase-12-documentation-operations.md",
    "task-specs/phase-13-release-deploy.md"
  ],
  "task_node_ids": [
    "SYS-DOCS-CMS-P01",
    "SYS-DOCS-CMS-P02",
    "SYS-DOCS-CMS-P03",
    "SYS-DOCS-CMS-P04",
    "SYS-DOCS-CMS-P05",
    "SYS-DOCS-CMS-P06",
    "SYS-DOCS-CMS-P07",
    "SYS-DOCS-CMS-P08",
    "SYS-DOCS-CMS-P09",
    "SYS-DOCS-CMS-P10",
    "SYS-DOCS-CMS-P11",
    "SYS-DOCS-CMS-P12",
    "SYS-DOCS-CMS-P13"
  ]
}
